{"$schema":"https://json-schema.org/draft/2020-12/schema","$id":"design-preview-feedback.schema.json","type":"object","additionalProperties":false,"required":["schema_version","artifact_type","deck_id","preview_manifest_sha256","decision","change_scope","affected_slide_ids","user_message_sha256"],"properties":{"schema_version":{"const":"1.0"},"artifact_type":{"const":"design_preview_feedback"},"deck_id":{"type":"string","minLength":1},"preview_manifest_sha256":{"type":"string","pattern":"^[a-f0-9]{64}$"},"decision":{"enum":["accepted","changes_requested","rejected"]},"change_scope":{"enum":["none","local_visual","global_style","content"]},"affected_slide_ids":{"type":"array","uniqueItems":true,"items":{"type":"string"}},"user_message_sha256":{"type":"string","pattern":"^[a-f0-9]{64}$"}}}
